{
"Record_ID":1,
"Record_ID-myngl-security": "",
"Record_Date_Stamp": "datetime",
"Record_Date_Stamp-myngl-security": "",
"Agency_ID": "alphanumeric",
"Agency_ID-myngl-security": "",
"Agency_Name": "alphanumeric",
"Agency_Name-myngl-security": "",
"Agency_Address": "alphanumeric",
"Agency_Address-myngl-security": "",
"Agency_City": "alphanumeric",
"Agency_City-myngl-security": "",
"Agency_Zip":1,
"Agency_Zip-myngl-security": "",
"Agency_State": "alpha" ,
"Agency_State-myngl-security": "",
"First_Name": "alpha",
"First_Name-myngl-security": "",
"Middle_Init": "alpha",
"Middle_Init-myngl-security": "",
"Last_Name": "alpha",
"Last_Name-myngl-security": "",
"SSN":1,
"SSN-myngl-security": "",
"Name":1,
"Name-myngl-security": "",
"Address": "alphanumeric",
"Address-myngl-security": "",
"City": "alphanumeric",
"City-myngl-security": "",
"Zip":1,
"Zip-myngl-security": "",
"State": "alpha" ,
"State-myngl-security": "",
"Tax_Lien_Status":1,
"Tax_Lien_Date": "date",
"Tax_Lien_Date-myngl-security": "",
"Tax_Lien_Amount": "date",
"Tax_Lien_Amount-myngl-security": "",
"Tax_Lien_Current_Balance":1,
"Tax_Lien_Last_Payment_Date": "date",
"Tax_Lien_Last_Payment_Date-myngl-security": ""
}
