{
"Record_ID":1,
"Record_Date_Stamp": "datetime",
"Agency_ID": "alphanumeric",
"Agency_Name": "alphanumeric",
"Agency_Address": "alphanumeric",
"Agency_City": "alphanumeric",
"Agency_Zip":1,
"Agency_State": "alpha" ,
"First_Name": "alpha",
"Middle_Init": "alpha",
"Last_Name": "alpha",
"SSN":1,
"Name":1,
"Address": "alphanumeric",
"City": "alphanumeric",
"Zip":1,
"State": "alpha" ,
"Tax_Lien_Status":1,
"Tax_Lien_Date": "date",
"Tax_Lien_Amount": "date",
"Tax_Lien_Current_Balance":1,
"Tax_Lien_Last_Payment_Date": "date"
}
